id,name,category,alignment,lat,lon,lore,source
122,Vila,Spirits,Benevolent,43.21,19.05,Beautiful mountain nymphs who can heal or shoot arrows at enemies.,https://www.tandfonline.com/doi/full/10.1080/17445647.2013.867544?scroll=top&needAccess=true#d1e129
123,Samovila,Spirits,Ambivalent,42.7,23.33,Forest spirits in the Balkans who guard the waters and dance in circles.,https://www.tandfonline.com/doi/full/10.1080/17445647.2013.867544?scroll=top&needAccess=true#d1e129
124,Zmey Gorynych,Dragons,Malicious,55.75,37.61,A three-headed Russian dragon that kidnaps women and burns villages.,https://www.tandfonline.com/doi/full/10.1080/17445647.2013.867544?scroll=top&needAccess=true#d1e129
125,Poludnica,Spirits,Malicious,50.0,20.0,The Lady Midday who strikes those working in the fields during high noon.,https://www.tandfonline.com/doi/full/10.1080/17445647.2013.867544?scroll=top&needAccess=true#d1e129
126,Besta,Zanmarphic Animals,Malicious,40.0,-8.0,A Portuguese monstrous beast often used as a general term for demons.,https://www.tandfonline.com/doi/full/10.1080/17445647.2013.867544?scroll=top&needAccess=true#d1e129
